{
  "$schema": "https://notation.randsum.dev/conformance/conformance.schema.json",
  "$id": "https://notation.randsum.dev/conformance/v0.9.0.json",
  "specVersion": "0.9.0",
  "conformanceLevels": {
    "level1_core": [1, 2, 3, 10, 11, 14, 15, 16, 19, 20, 26, 27],
    "level2_vtt": [
      1, 2, 3, 9, 10, 11, 12, 13, 14, 15, 16, 18, 19, 20, 21, 22, 26, 27, 43, 45, 55, 56, 59
    ],
    "level3_extended": [
      1, 2, 3, 4, 5, 6, 7, 8, 9, 10, 11, 12, 13, 14, 15, 16, 17, 18, 19, 20, 21, 22, 24, 25, 26, 27,
      31, 35, 36, 37, 40, 41, 42, 43, 44, 45, 49, 50, 55, 56, 57, 58, 59
    ],
    "level4_full": [
      1, 2, 3, 4, 5, 6, 7, 8, 9, 10, 11, 12, 13, 14, 15, 16, 17, 18, 19, 20, 21, 22, 23, 24, 25, 26,
      27, 31, 32, 33, 34, 35, 36, 37, 38, 39, 40, 41, 42, 43, 44, 45, 49, 50, 51, 55, 56, 57, 58, 59
    ],
    "errorCases": [28, 29, 30, 46, 47, 48, 52, 53, 54, 60, 61]
  },
  "vectors": [
    {
      "id": 1,
      "notation": "1d20",
      "category": "dice_expressions",
      "seedRolls": [14],
      "expectedPool": [14],
      "expectedTotal": 14,
      "section": "4.1",
      "conformanceLevel": 1
    },
    {
      "id": 2,
      "notation": "d20",
      "category": "dice_expressions",
      "seedRolls": [14],
      "expectedPool": [14],
      "expectedTotal": 14,
      "section": "4.1",
      "conformanceLevel": 1
    },
    {
      "id": 3,
      "notation": "3d6",
      "category": "dice_expressions",
      "seedRolls": [3, 5, 2],
      "expectedPool": [3, 5, 2],
      "expectedTotal": 10,
      "section": "4.1",
      "conformanceLevel": 1
    },
    {
      "id": 4,
      "notation": "d%",
      "category": "dice_expressions",
      "seedRolls": [73],
      "expectedPool": [73],
      "expectedTotal": 73,
      "section": "4.5.1",
      "conformanceLevel": 3
    },
    {
      "id": 5,
      "notation": "4dF",
      "category": "dice_expressions",
      "seedRolls": [-1, 0, 1, 1],
      "expectedPool": [-1, 0, 1, 1],
      "expectedTotal": 1,
      "section": "4.5.2",
      "conformanceLevel": 3
    },
    {
      "id": 6,
      "notation": "1dF.2",
      "category": "dice_expressions",
      "seedRolls": [-2],
      "expectedPool": [-2],
      "expectedTotal": -2,
      "section": "4.5.2",
      "conformanceLevel": 3
    },
    {
      "id": 7,
      "notation": "4d6C{5}",
      "category": "stage1_modifiers",
      "seedRolls": [6, 3, 5, 6],
      "expectedPool": [5, 3, 5, 5],
      "expectedTotal": 18,
      "section": "6.4.2",
      "conformanceLevel": 3
    },
    {
      "id": 8,
      "notation": "4d6V{1=6,3=5}",
      "category": "stage1_modifiers",
      "seedRolls": [1, 3, 4, 1],
      "expectedPool": [6, 5, 4, 6],
      "expectedTotal": 21,
      "section": "6.4.3",
      "conformanceLevel": 3
    },
    {
      "id": 9,
      "notation": "4d6R{1}",
      "category": "stage2_modifiers",
      "seedRolls": [1, 3, 5, 2],
      "rerollRolls": [4],
      "expectedPool": [4, 3, 5, 2],
      "expectedTotal": 14,
      "section": "6.5.2",
      "conformanceLevel": 2
    },
    {
      "id": 10,
      "notation": "4d6L",
      "category": "stage2_modifiers",
      "seedRolls": [3, 5, 2, 6],
      "expectedPool": [3, 5, 6],
      "expectedTotal": 14,
      "section": "6.5.4",
      "conformanceLevel": 1
    },
    {
      "id": 11,
      "notation": "4d6H",
      "category": "stage2_modifiers",
      "seedRolls": [3, 5, 2, 6],
      "expectedPool": [3, 5, 2],
      "expectedTotal": 10,
      "section": "6.5.4",
      "conformanceLevel": 1
    },
    {
      "id": 12,
      "notation": "4d6!",
      "category": "stage2_modifiers",
      "seedRolls": [6, 3, 5, 2],
      "explodeRolls": [4],
      "expectedPool": [6, 3, 5, 2, 4],
      "expectedTotal": 20,
      "section": "6.5.6",
      "conformanceLevel": 2
    },
    {
      "id": 13,
      "notation": "4d6!",
      "category": "stage2_modifiers",
      "seedRolls": [3, 4, 2, 5],
      "expectedPool": [3, 4, 2, 5],
      "expectedTotal": 14,
      "section": "6.5.6",
      "conformanceLevel": 2
    },
    {
      "id": 14,
      "notation": "2d6+5",
      "category": "stage3_modifiers",
      "seedRolls": [3, 4],
      "expectedPool": [3, 4],
      "expectedTotal": 12,
      "section": "6.6.4",
      "conformanceLevel": 1
    },
    {
      "id": 15,
      "notation": "2d6-3",
      "category": "stage3_modifiers",
      "seedRolls": [4, 5],
      "expectedPool": [4, 5],
      "expectedTotal": 6,
      "section": "6.7.4",
      "conformanceLevel": 1
    },
    {
      "id": 16,
      "notation": "2d6*3",
      "category": "stage3_modifiers",
      "seedRolls": [2, 4],
      "expectedPool": [2, 4],
      "expectedTotal": 18,
      "section": "6.6.3",
      "conformanceLevel": 1
    },
    {
      "id": 17,
      "notation": "2d6//3",
      "category": "stage3_modifiers",
      "seedRolls": [4, 5],
      "expectedPool": [4, 5],
      "expectedTotal": 3,
      "section": "6.6.5",
      "conformanceLevel": 3
    },
    {
      "id": 18,
      "notation": "5d10#{>=7}",
      "category": "stage3_modifiers",
      "seedRolls": [8, 3, 10, 7, 2],
      "expectedPool": [8, 3, 10, 7, 2],
      "expectedTotal": 3,
      "section": "6.6.2",
      "conformanceLevel": 2
    },
    {
      "id": 19,
      "notation": "4d6K3",
      "category": "aliases",
      "seedRolls": [2, 5, 3, 6],
      "expectedPool": [5, 3, 6],
      "expectedTotal": 14,
      "section": "6.7.1",
      "conformanceLevel": 1
    },
    {
      "id": 20,
      "notation": "4d6kl",
      "category": "aliases",
      "seedRolls": [2, 5, 3, 6],
      "expectedPool": [2],
      "expectedTotal": 2,
      "section": "6.7.1",
      "conformanceLevel": 1
    },
    {
      "id": 21,
      "notation": "5d10S{7}",
      "category": "aliases",
      "seedRolls": [8, 3, 10, 7, 2],
      "expectedPool": [8, 3, 10, 7, 2],
      "expectedTotal": 3,
      "section": "6.7.7",
      "conformanceLevel": 2
    },
    {
      "id": 22,
      "notation": "5d10F{3}",
      "category": "aliases",
      "seedRolls": [8, 3, 10, 1, 2],
      "expectedPool": [8, 3, 10, 1, 2],
      "expectedTotal": 3,
      "section": "6.7.8",
      "conformanceLevel": 2
    },
    {
      "id": 23,
      "notation": "1d20ms{15}",
      "category": "aliases",
      "seedRolls": [18],
      "expectedPool": [18],
      "expectedTotal": 3,
      "section": "6.7.5",
      "conformanceLevel": 4
    },
    {
      "id": 24,
      "notation": "4d6sa",
      "category": "non_modifier_features",
      "seedRolls": [3, 1, 5, 2],
      "expectedPool": [1, 2, 3, 5],
      "expectedTotal": 11,
      "section": "6.8.1",
      "conformanceLevel": 3
    },
    {
      "id": 25,
      "notation": "2d6+3[fire]",
      "category": "non_modifier_features",
      "seedRolls": [4, 5],
      "expectedPool": [4, 5],
      "expectedTotal": 12,
      "section": "6.8.2",
      "conformanceLevel": 3
    },
    {
      "id": 26,
      "notation": "2D6",
      "category": "case_insensitivity",
      "seedRolls": [3, 4],
      "expectedPool": [3, 4],
      "expectedTotal": 7,
      "section": "8.1",
      "conformanceLevel": 1
    },
    {
      "id": 27,
      "notation": "4D6l",
      "category": "case_insensitivity",
      "seedRolls": [3, 5, 2, 6],
      "expectedPool": [3, 5, 6],
      "expectedTotal": 14,
      "section": "8.1",
      "conformanceLevel": 1
    },
    {
      "id": 28,
      "notation": "4d",
      "category": "error_cases",
      "section": "9.5",
      "conformanceLevel": 1,
      "expectedError": true
    },
    {
      "id": 29,
      "notation": "d",
      "category": "error_cases",
      "section": "9.5",
      "conformanceLevel": 1,
      "expectedError": true
    },
    {
      "id": 30,
      "notation": "d0",
      "category": "error_cases",
      "section": "9.5",
      "conformanceLevel": 1,
      "expectedError": true
    },
    {
      "id": 31,
      "notation": "2d{fire,ice,lightning}",
      "category": "extended_coverage",
      "seedRolls": [2, 1],
      "expectedPool": ["ice", "fire"],
      "expectedTotal": null,
      "section": "4.2",
      "conformanceLevel": 3,
      "note": "Face indices: 1=fire, 2=ice, 3=lightning. Roll values map to face labels.",
      "unseeded": {
        "faces": ["fire", "ice", "lightning"]
      }
    },
    {
      "id": 32,
      "notation": "g6",
      "category": "extended_coverage",
      "seedRolls": [6, 6, 3],
      "expectedPool": [6, 6, 3],
      "expectedTotal": 15,
      "section": "4.3",
      "conformanceLevel": 4
    },
    {
      "id": 33,
      "notation": "3DD6",
      "category": "extended_coverage",
      "seedRolls": [4, 1, 6],
      "expectedPool": [4, 1, 6],
      "expectedTotal": 11,
      "section": "4.4",
      "conformanceLevel": 4,
      "unseeded": {
        "faces": [1, 2, 3, 4, 5, 6],
        "distinct": true
      }
    },
    {
      "id": 34,
      "notation": "z6",
      "category": "extended_coverage",
      "seedRolls": [0],
      "expectedPool": [0],
      "expectedTotal": 0,
      "section": "4.5.3",
      "conformanceLevel": 4
    },
    {
      "id": 35,
      "notation": "3d6U",
      "category": "extended_coverage",
      "seedRolls": [3, 3, 5],
      "rerollRolls": [4],
      "expectedPool": [3, 4, 5],
      "expectedTotal": 12,
      "section": "6.5.3",
      "conformanceLevel": 3
    },
    {
      "id": 36,
      "notation": "2d6!!",
      "category": "extended_coverage",
      "seedRolls": [6, 3],
      "compoundRolls": [4],
      "expectedPool": [10, 3],
      "expectedTotal": 13,
      "section": "6.5.8",
      "conformanceLevel": 3
    },
    {
      "id": 37,
      "notation": "2d6!p",
      "category": "extended_coverage",
      "seedRolls": [6, 3],
      "penetrateRolls": [3],
      "expectedPool": [8, 3],
      "expectedTotal": 11,
      "section": "6.5.9",
      "conformanceLevel": 3
    },
    {
      "id": 38,
      "notation": "5d6W",
      "category": "extended_coverage",
      "seedRolls": [6, 3, 4, 2, 5],